{"schema_version":1,"id":"nx2606.export.step214-creator","nx_version":"NX 2606","status":"rejected","api_family":"NXOpen.Step214Creator","required_imports":["NXOpen"],"required_api_objects":["NXOpen.DexManager.CreateStep214Creator","NXOpen.Step214Creator.Commit"],"fixture":"assets/runtime-probes/nx2606/10_step_ap242.py","runtime_result":"runtime-results/nx2606/step214-creator.failure.json","known_incompatibilities":["NX 2606 binding reports that DexManager has no CreateStep214Creator attribute; use CreateStepCreator."]}
