{
  "schema_version": 1,
  "id": "nx2606.export.step-creator",
  "nx_version": "NX 2606",
  "status": "verified",
  "api_family": "NXOpen.StepCreator",
  "required_imports": [
    "NXOpen"
  ],
  "required_api_objects": [
    "NXOpen.DexManager.CreateStepCreator",
    "NXOpen.StepCreator.ExportAsOption.Ap242",
    "NXOpen.StepCreator.ExportFromOption.ExistingPart",
    "NXOpen.StepCreator.InputFile",
    "NXOpen.StepCreator.ObjectTypes",
    "NXOpen.ObjectTypeSelector.Solids",
    "NXOpen.StepCreator.Commit",
    "NXOpen.StepCreator.Destroy"
  ],
  "fixture": "cadnx/builder.py",
  "runtime_result": "runtime-results/nx2606/bearing-support-housing.success.json",
  "known_incompatibilities": [
    "CreateStep214Creator is absent in the tested NX 2606 binding.",
    "DisplayPart without InputFile produced no STEP; DisplayPart with InputFile produced metadata-only AP242 output even with ObjectTypes.Solids enabled.",
    "Verified scope is AP242 export from the saved current-run PRT using ExportFrom=ExistingPart, InputFile, ObjectTypes.Solids=True, ProcessHoldFlag=True, Commit(), and Destroy()."
  ]
}
