{"schema_version":1,"id":"nx2606.boolean.unite","nx_version":"NX 2606","status":"verified","api_family":"NXOpen.Features.BooleanBuilder","required_imports":["NXOpen","NXOpen.Features"],"required_api_objects":["NXOpen.Features.BooleanBuilder","NXOpen.Features.Feature.BooleanType.Unite"],"fixture":"assets/runtime-probes/nx2606/08_boolean_unite.py","runtime_result":"runtime-results/nx2606/boolean-unite.success.json","known_incompatibilities":[]}
