{
  "schema_version": 1,
  "id": "nx2606.sweep.rotated-section-twist",
  "nx_version": "NX 2606",
  "status": "verified",
  "api_family": "NXOpen.Features.SweptBuilder1",
  "required_imports": ["NXOpen", "NXOpen.Features", "NXOpen.GeometricUtilities"],
  "required_api_objects": [
    "NXOpen.Features.FreeformSurfaceCollection.CreateSweptBuilder1",
    "NXOpen.Features.SweptBuilder1.SectionList",
    "NXOpen.Features.SweptBuilder1.GuideList",
    "NXOpen.Features.SweptBuilder1.InterpolationOptions.Linear",
    "NXOpen.GeometricUtilities.FeatureOptions.BodyStyle.Solid"
  ],
  "fixture": "assets/runtime-probes/nx2606/07_sweep_angular_law.py",
  "runtime_result": "runtime-results/nx2606/sweep-rotated-section-twist.success.json",
  "known_incompatibilities": [
    "This recipe creates twist by rotating the terminal section geometry; it does not use OrientationOptions.ByAngularLaw.",
    "Verification covers two rectangular sections, a 20-degree terminal-section rotation around the corresponding guide corner, and one straight guide."
  ]
}
