{"schema_version":1,"id":"nx2606.edge-blend.chainset","nx_version":"NX 2606","status":"verified","api_family":"NXOpen.Features.EdgeBlendBuilder","required_imports":["NXOpen","NXOpen.Features"],"required_api_objects":["NXOpen.Features.EdgeBlendBuilder.AddChainset","NXOpen.ScCollector"],"fixture":"assets/runtime-probes/nx2606/09_edge_blend.py","runtime_result":"runtime-results/nx2606/edge-blend.success.json","known_incompatibilities":["Only a single cylinder edge chain with radius 2.0 mm is verified."]}
