{"schema_version":1,"id":"nx2606.section.periodic-spline","nx_version":"NX 2606","status":"verified","api_family":"NXOpen.Features.StudioSplineBuilderEx","required_imports":["NXOpen","NXOpen.Features"],"required_api_objects":["NXOpen.Features.StudioSplineBuilderEx","NXOpen.GeometricConstraintData"],"fixture":"assets/runtime-probes/nx2606/03_closed_spline_section.py","runtime_result":"runtime-results/nx2606/periodic-spline.success.json","known_incompatibilities":[]}
