{"schema_version":1,"id":"nx2606.section.closed-polyline","nx_version":"NX 2606","status":"verified","api_family":"NXOpen.Section","required_imports":["NXOpen"],"required_api_objects":["NXOpen.Section","NXOpen.ScRuleFactory.CreateRuleBaseCurveDumb"],"fixture":"assets/runtime-probes/nx2606/02_closed_polyline_section.py","runtime_result":"runtime-results/nx2606/closed-polyline-section.success.json","known_incompatibilities":[]}
